{
  "scope": "haryana",
  "title": "Normative requirements added by Haryana's own instruments for a cheque-bounce case",
  "note": "Haryana has not amended section 138 of the Negotiable Instruments Act, so nothing here restates the offence, the notice period, the presumptions, limitation or compounding. What is here is what the Punjab and Haryana High Court's own instruments require on top of central law, or where one of them tightens a national obligation: Rules and Orders Volume III (Instructions to Criminal Courts), the Electronic Filing Rules, the Rules for Video Conferencing for Courts, the e-filing 3.0 changeover circular, the High Court's Court Fee Table, and the Haryana Police Act, 2007. Volume III is pre-2024 and speaks in the Code of Criminal Procedure numbering; where that matters the live Sanhita provision is cited beside it so the code-switch is visible. Categories NOT (the statutory demand notice) and PRE (presumptions and burden of proof) are deliberately empty: no Haryana instrument in this corpus touches either, and everything on them belongs in the national file.",
  "requirements": [
    {
      "id": "REQ-HR-LIM-001",
      "category": "LIM",
      "level": "MUST",
      "statement": "The system MUST fix the date of an e-filed complaint as the date the Action was electronically received in the Registry of the Punjab and Haryana court within the prescribed time on a working day, reckoned in Indian Standard Time.",
      "why": "A cheque complaint dies on a day. If the portal stamps a filing with the advocate's local device clock, or with the date the Registry later opened it, a NACT complaint received at 23:50 IST on the last day of the one-month window under section 142(1)(b) will be recorded as filed the next day and rejected as time-barred, and a complaint received after the window will look in time. The Electronic Filing Rules fix one clock and one moment of receipt for the whole High Court jurisdiction.",
      "authority": [
        {
          "l": "P&H HC E-Filing Rules r.15.1 (Computation of Time)",
          "s": "phef",
          "e": "rule_15"
        },
        {
          "l": "NI Act §142(1)(b)",
          "n": "ni:sec_142"
        }
      ],
      "binds": {
        "artifact": "schema-field",
        "target": "complaint record - date of e-filing, stamped on receipt in the Registry"
      },
      "how": "The timestamp is the Registry's receipt time in Indian Standard Time, not the filer's device time and not the date of scrutiny or acceptance.",
      "test": "Submit an Action from a client whose clock is set to a different timezone; the stored filing date is the Registry receipt date in IST, and it does not change when the Registry later accepts or objects to the filing.",
      "derivedFrom": "rule",
      "status": "firm",
      "statusReason": "Rule 15.1 states both limbs the requirement needs: the date of e-filing is the date the Action is electronically received in the Registry within the prescribed time on a working day, and Indian Standard Time applies to computing the time of filing. Nothing is read in. The requirement only holds that moment of receipt apart from the filer's own clock and from the later date on which the Registry accepts or objects, which the rule already excludes by naming receipt.",
      "tightens": "REQ-LIM-007",
      "relatedTo": []
    },
    {
      "id": "REQ-HR-LIM-002",
      "category": "LIM",
      "level": "MUST",
      "statement": "The system MUST date an online e-filing carried out after 2400 hours as the day that follows the actual filing date, provided that following day is a court working day.",
      "why": "Advocates file cheque complaints late at night on the last day of limitation. A system that simply stores the wall-clock date will treat a filing made at 00:20 as belonging to the day that has just begun, which is the day the Electronic Filing Rules also assign to it, but will get the working-day proviso wrong: if the following day is not a court working day the roll-forward has to continue. Getting that wrong by one day is the whole case.",
      "authority": [
        {
          "l": "P&H HC E-Filing Rules r.15.2 (Computation of Time)",
          "s": "phef",
          "e": "rule_15"
        }
      ],
      "binds": {
        "artifact": "validation-rule",
        "target": "e-filing date roll-forward across midnight"
      },
      "how": "The rule states the roll-forward and its working-day condition; the court calendar published under E-Filing Rules r.3.22 supplies the working days.",
      "test": "File at 00:20 IST on a court working day and the recorded date is that day; file at 00:20 on a day that is not a court working day and the date rolls to the next working day.",
      "derivedFrom": "rule",
      "status": "firm",
      "statusReason": "Rule 15.2 states the roll-forward and its condition in terms: an online e-filing carried out after 2400 hours will be treated as bearing the date which follows the actual filing date, provided that day is a court working day. The requirement adds only that the working-day proviso be applied rather than assumed, and the proviso is the rule's own.",
      "tightens": null,
      "relatedTo": [
        "REQ-HR-LIM-001"
      ]
    },
    {
      "id": "REQ-HR-LIM-003",
      "category": "LIM",
      "level": "MUST",
      "statement": "The system MUST date an Action filed on a gazetted holiday, or on a day the Punjab and Haryana court is closed, as filed on the next working day.",
      "why": "The e-filing portal is open twenty four hours. A payee who files a cheque complaint on a gazetted holiday because the one-month window expires that day gains nothing: the filing is dated to the next working day. A system that records the holiday date as the institution date will show the complaint as in time when the court will treat it as filed later, and no delay-condonation application will have been prepared.",
      "authority": [
        {
          "l": "P&H HC E-Filing Rules r.15.2 (Computation of Time)",
          "s": "phef",
          "e": "rule_15"
        }
      ],
      "binds": {
        "artifact": "validation-rule",
        "target": "e-filing date on a gazetted holiday or court-closed day"
      },
      "how": "The next working day is taken from the calendar published for the court, or as directed by the court, under E-Filing Rules r.3.22.",
      "test": "Submit an Action on a listed gazetted holiday; the stored institution date is the next working day and the filer is shown that date before submitting.",
      "derivedFrom": "rule",
      "status": "firm",
      "statusReason": "Rule 15.2 says that Actions filed on a day declared a gazetted holiday, or on a day when the court is closed, will be regarded as having been filed on the next working day. The consequence is stated; the requirement restates it and does no construction.",
      "tightens": null,
      "relatedTo": [
        "REQ-HR-LIM-001"
      ]
    },
    {
      "id": "REQ-HR-LIM-004",
      "category": "LIM",
      "level": "MUST NOT",
      "statement": "The system MUST NOT accept an e-filing at a Designated Counter after 1600 hours on a court working day.",
      "why": "The counter route is the fallback a Panchkula advocate uses when the portal is down or the file is too large. It closes at four in the afternoon, two and a half hours before the portal's own midnight cut-off. A filer who is told at 1700 that the counter can still take a cheque complaint on the last day of limitation has been told something the rules do not allow, and the complaint will not be received that day at all.",
      "authority": [
        {
          "l": "P&H HC E-Filing Rules r.15.2 (Computation of Time)",
          "s": "phef",
          "e": "rule_15"
        },
        {
          "l": "P&H HC E-Filing Rules r.4.3 (Designated Counters)",
          "s": "phef",
          "e": "rule_4"
        }
      ],
      "binds": {
        "artifact": "validation-rule",
        "target": "Designated Counter e-filing cut-off"
      },
      "how": null,
      "test": "The counter intake screen refuses a new Action after 1600 hours on a court working day and states the cut-off; the online portal remains open until 2400 hours on the same day.",
      "derivedFrom": "rule",
      "status": "firm",
      "statusReason": "Rule 15.2 makes e-filing through Designated Counters permissible up to 1600 hours on a court working day, and the same sub-rule keeps the online portal open past midnight, so the two cut-offs are stated side by side. Refusing a counter filing after 1600 reads a permission that stops there rather than adding anything to it.",
      "tightens": null,
      "relatedTo": [
        "REQ-HR-LIM-001"
      ]
    },
    {
      "id": "REQ-HR-LIM-005",
      "category": "LIM",
      "level": "MUST NOT",
      "statement": "The system MUST NOT offer or record failure of the web-based e-filing facility as a ground of exemption from limitation.",
      "why": "The Electronic Filing Rules say in terms that no exemption from limitation is permitted on the ground that the online facility failed, and direct the filer to a Designated Counter or to physical filing instead. A cheque complainant who is allowed to log a portal outage as a reason for filing late will present that reason to the magistrate, who cannot accept it, and will have spent the last day of the one-month window logging a defence instead of walking the file to the counter.",
      "authority": [
        {
          "l": "P&H HC E-Filing Rules r.15.3 (Computation of Time)",
          "s": "phef",
          "e": "rule_15"
        },
        {
          "l": "NI Act §142(1)(b) proviso",
          "n": "ni:sec_142"
        }
      ],
      "binds": {
        "artifact": "screen",
        "target": "delay-condonation reasons offered to an e-filer"
      },